{"agentProcessesPerCandidate":2,"baselineCandidate":"margin-0.3.2-structured-manual-v17","benchmarkVersion":"0.1.0","candidate":"margin-0.3.2-agent-recovery-v20","controlProfile":"role-separated-margin-only-v1","developmentCases":true,"episodeCount":1,"episodes":[{"agentProcessCount":2,"candidateOrder":["margin-0.3.2-structured-manual-v17","margin-0.3.2-agent-recovery-v20"],"fingerprint":"00a47f179db6cf46601030ae44d931c673d30d883dc9a2c42faf4fe944dcecab","id":"staged_multifile:0:00a47f179db6","phasePolicy":"scenario-defined","repetition":0,"roles":["author","reviewer"],"scenario":"staged_multifile","traceSeats":["author","reviewer"]}],"minimumPairsForPromotion":20,"repetitions":1,"roleRunsPerCandidate":2,"sampleSizeSufficient":false,"scenarioIDs":["staged_multifile"],"schema":"urn:marginbench:study-plan:v1","taskSet":"public-development-v1","totalAgentProcesses":4,"totalRoleRuns":4}
